"Link","Abstract","Author Keywords","Index Keywords"
"https://www.scopus.com/inward/record.uri?eid=2-s2.0-85161169061&doi=10.1007%2f978-3-031-15203-0&partnerID=40&md5=645c299001f2c4a506f380972e9a40bd","Public innovation is distinctive from private sector innovation by being set in a political system rather than a market. The roles of citizens and elected politicians as well as public servants and other stakeholders are frequently relevant. Public organizations can be creators, funders, orchestrators or sense-makers of innovations, which are carried out with the aim of benefitting society. This book provides a comprehensive insight into the theory and practice of public innovation using a wide range of research evidence about the processes, drivers and barriers, stakeholders and outcomes of innovation. Using the lens of public value, the book offers a stimulating discussion of how public innovation is valued and contested in current societies. Valuing Public Innovation aims to help develop a deeper understanding of innovation and how to use that knowledge in practical ways. This is essential reading for academics and students in the fields of innovation, organisation studies, public administration and public policy, as well as for policymakers and practitioners. © The Editor(s) (if applicable) and The Author(s), under exclusive license to Springer Nature Switzerland AG 2022.","Collaborative innovation; Diffusion; Public innovation; Public management; Public sphere",""
"https://www.scopus.com/inward/record.uri?eid=2-s2.0-85123088870&doi=10.1002%2fjoe.22151&partnerID=40&md5=2fae17a1ba1dccbe8f631bae021cf916","This study uses the theory of planned behavior, and social cognitive career theory, to examine the effect of entrepreneurial education, entrepreneurial mindset, and cognitive mediators on entrepreneurial intention and entrepreneurial competencies. Adopting a cross-sectional design, it uses data from 290 university students, from a variety of academic backgrounds, to test several hypotheses using partial least squares structural equation modeling. The results show that entrepreneurial education and cognitive mediators are critical for stimulating entrepreneurial behavior. The results also show that entrepreneurial mindset is formed from entrepreneurial education, and that it plays a vital role in driving entrepreneurial intention. Finally, our results indicate that entrepreneurial passion is a moderator that shapes self-efficacy and attitudes towards entrepreneurship. These findings offer insights that could act as a reference point for academicians, educators, or anyone else who engages in creating or expanding knowledge related to entrepreneurship. © 2022 Wiley Periodicals LLC","entrepreneurial education; entrepreneurial intention; entrepreneurial mindset; entrepreneurial passion; entrepreneurial self-efficacy",""
"https://www.scopus.com/inward/record.uri?eid=2-s2.0-85097006050&doi=10.1108%2fJMD-05-2020-0164&partnerID=40&md5=10ec1fb5c5a9d6e4c29789fc7cf1caad","Purpose: The purpose of this paper is to draw attention to the lack of a clear theoretical framework in management education programs to allow students to understand the world in which gig workers operate. The article asserts the need for practical guidance for pedagogy to prepare students to manage in the gig economy. Design/methodology/approach: This paper provides a rationale for the assertion that, beyond training students to create their own work configurations in the new world of work, management education should acquaint students with the specific challenges faced by managers responsible for a spectrum of workers in various work configurations. This paper explicates gig work configurations and offers theoretical and practical issues related to worker and manager identity to be considered in the development of an educational framework. Findings: Management curricula over time have successfully augmented several competencies to the manager identity. Bolstering the competency of simultaneously managing employees working in multiple employment arrangements is the next natural progression of management education. Practical implications: Particular challenges for prospective “gig managers” may relate to the management of somewhat elusive processes that enhance their own and their workers' organizational identity and related outcomes. Originality/value: The authors invoke the literature of holding environments for identity development, along with the distinctness and inclusion facets of Kegan's theory of the evolution of consciousness and tenets of institutional theory, in a call for the examination of methods that may help aspirant managers recognize distinction and inclusion needs in others and cultivate tools to assist in their workers' need fulfillment. © 2020, Emerald Publishing Limited.","Business education; Gig workers; Management education; Social identity; Work identity",""
"https://www.scopus.com/inward/record.uri?eid=2-s2.0-85108784914&doi=10.1108%2fIJGE-07-2020-0099&partnerID=40&md5=731c6054426f014d0485b2c766206300","Purpose: The promotion of research-based entrepreneurship is considered a crucial task for universities and policymakers in many Western countries. Research has shown that the university environment plays a decisive role in the spin-off activities of researchers. Although the number of science-based spin-offs has increased in recent years, women are still an exception when it comes to developing spin-off ventures. In turn, there is a lack of knowledge regarding the university environment that supports entrepreneurship from a gender perspective. Design/methodology/approach: Based on the theoretical framework of the “Entrepreneurial University,” this contribution examines the formal and informal conditions for academic entrepreneurship using the example of Swiss universities of applied sciences (UAS). Based on a cross-sectional dataset of 1,551 researchers from various disciplines who were surveyed in 2019, linear regressions and logistic regression models were used to test gender-specific differences in the perception of organizational conditions concerning the entrepreneurial exploitation of research. Findings: The results demonstrated significant differences in the perception of formal and informal conditions in higher education. First, they show gender differences in the perception of informal entrepreneurial support in universities; in particular, female researchers received less informal support for spin-off projects. For example, women hardly viewed commercial use of research and development knowledge as a career option and considered the existence of entrepreneurial role models at universities to be low. Second, further analyses highlighted that also formal support offerings were less known among female researchers. Originality/value: The study highlights organizational barriers for female researchers regarding the development of spin-off creation at UAS, including the different formal and informal conditions for female academics in comparison to their male counterparts. © 2021, Emerald Publishing Limited.","Academic entrepreneurship; Gender; Organizational framework; Spin-off",""
"https://www.scopus.com/inward/record.uri?eid=2-s2.0-85136371599&partnerID=40&md5=288707cee43a1a78162f922f60628db0","[No abstract available]","",""
"https://www.scopus.com/inward/record.uri?eid=2-s2.0-85158045780&partnerID=40&md5=d122fd1850b56aa3ff95aca8bbfadade","he worldwide increase in societal challenges, such as climate change, political instability, and economic volatility, puts pressure on institutions, organisations, and individuals to develop means to address social problems. Unfortunately, many organisations fail to adequately formulate social problems and even solve the wrong ones, which is due to their inherent complexity. Consequently, this dissertation adopts a 'complexity lens' to interpret the intertwined forces driving social problems within organisational and environmental contexts. Problem complexity requires different governance modes, as solutions cannot be developed in the typical linear and hierarchical process that commercial products follow. To this end, this dissertation entails two studies that explore how the complexity of social problems can be managed at the organisational and individual level. In particular, study 1 employs Procedural Action Research and mixed methods together with a humanitarian organisation to qualitatively develop and quantitatively validate a theory-guided bottom-up search process for surfacing solutions to reoccurring floods in Indonesia. In a similar vein, study 2 investigates and compares the individual innovation processes of 20 social entrepreneurs from Ethiopia and Germany. © Logos Verlag Berlin GmbH 2022. All rights reserved.","",""
"https://www.scopus.com/inward/record.uri?eid=2-s2.0-85115964641&doi=10.1016%2fj.techfore.2021.121223&partnerID=40&md5=3bf1d5edbbffb71a15f77f3583aeebb2","University-Industry collaboration (UIC) literature is largely documented with Western European or North-American evidence, where universities are rich in resources and have well-developed R&D infrastructure. Likewise, our knowledge remains limited about UIC in emerging countries, where research resources and R&D are scarce. In this article, we address the research question “What are the individual micro-processes involved in UICs with social impact in emerging economies” and argue that uncovering the individual micro-processes involved in university-industry joint undertakings contribute to understanding how entrepreneurial universities promote social impact in emerging economies. The ideas presented in this paper are based on exploratory qualitative research consisting of 33 semi-structured interviews, eight focus groups, and six participatory observations in Bolivia and Colombia. Our findings suggest that UICs in emerging economies are driven by the need to solve major social challenges and are often a consequence of the individual micro-processes of low subjective norm, pro-social behavior, deontic justice, social identity, entrepreneurial culture, and championing of social welfare. © 2021 Elsevier Inc.","Emerging economies; Entrepreneurial universities; Micro-processes; Social impact; University-industry collaboration","Bolivia; Colombia; Economic and social effects; Industrial economics; Emerging countries; Emerging economies; Entrepreneurial university; Microprocess; North American; Process approach; Social impact; Societal impacts; University industries; University-industry collaboration; entrepreneur; research and development; social impact; university sector; Social behavior"
"https://www.scopus.com/inward/record.uri?eid=2-s2.0-85139960276&doi=10.31577%2fekoncas.2021.10.03&partnerID=40&md5=592b6d8814659c087b3838df7f5b40ed","This study aims to assess whether the individual phases of the talent management process are equally important with respect to overall organizational performance. We analyse 381 business organizations in Slovakia. Authors use a linear regression model and ANOVA to evaluate the impact of the phases of the talent management process on the development of organizational performance of an organization and focus group approach to explain the differences in the individual phases of a talent management process. The results revealed that not all talent management phases equally influence the economic situation of the organization. The final two phases (development and retention) significantly influence the progress of the organizational performance while the initial phases (strategy, identification, and assessment) seem to have no impact on organizational performance. Financial efficiency should prioritize Retention, and only after focus on Development of talents. Remaining resources should be invested into Strategy, Assessment, and Identification of talented people. © 2021, Institute of Geography of the Slovak Academy of Science. All rights reserved.","economic situation; individual phases importance; organizational performance; talent management process","Slovakia; economic development; economic growth; organizational framework; performance assessment; regression analysis"
"https://www.scopus.com/inward/record.uri?eid=2-s2.0-85090715535&doi=10.9770%2fjesi.2020.7.4%2834%29&partnerID=40&md5=cdb88061430ebf2b6a3f4f6e5c32ffe3","The importance of macro conditions for creating an environment conducive for startups to establish themselves and grow is emphasised. This paper considers the influence of two sets of macro foundations, domestic ecosystems and entrepreneurial networks as well as entrepreneurship education and research, on perceived emerging micro entrepreneurial activity. We show that the domestic ecosystem affects entrepreneurial networks, and together with entrepreneurship education, they have an impact on emerging entrepreneurial activity. Macro entrepreneurial factors also drive emerging entrepreneurial activity directly, and these relationships call for more research. © 2020 by author(s) and VsI Entrepreneurship and Sustainability Center.","Domestic ecosystem; Entrepreneurial network; Entrepreneurship; Innovation; Startups",""
"https://www.scopus.com/inward/record.uri?eid=2-s2.0-85111615804&doi=10.1016%2fj.ijproman.2021.07.002&partnerID=40&md5=4f2e49ae714e08f17ef37346ae029add","Social procurement policies are becoming an increasingly popular tool for construction project clients to meet their corporate social responsibility objectives. This research employs New Institutional Theory to investigate the coercive, mimetic and normative drivers behind the adoption of social procurement policies in Australian construction projects. It presents a thematic analysis of semi-structured interviews with sixteen social procurement actors in the Australian construction industry who are responsible for implementing these policies at a project level. Results contribute new theoretical and practical insights into the nascent and under-theorized body of social procurement research in the field of project management. They indicate that coercive isomorphism is the most powerful driver of social procurement adoption in Australian construction projects, followed by mimetic isomorphism and normative isomorphism. It is concluded that the effective implementation of social procurement policies in construction projects requires project supply chains to shift from a compliance and mimicking mindset to one which normalizes social procurement. This will require institutional change based on the legitimisation of new social procurement professionals, roles and practices and the development of new project-based intermediaries to mitigate the risks and maximize the opportunities that social procurement presents. © 2021","Institutions; Isomorphism; Social impact; Social outcomes; Social procurement; Social value","Australia; Construction industry; Project management; Supply chains; Construction projects; Corporate social responsibilities (CSR); Institutional change; New Institutional Theory; Procurement policy; Procurement professionals; Semi structured interviews; Thematic analysis; compliance; construction industry; institutional framework; project assessment; project management; social impact; social policy; Set theory"
"https://www.scopus.com/inward/record.uri?eid=2-s2.0-85090085204&doi=10.1177%2f1936724420947012&partnerID=40&md5=4730a25c89981593c51859a8e4746998","This study applied an institutional logics framework to examine issues that challenged revitalization efforts in three distressed neighborhoods in an urban Midwest U.S. city. Specifically, it examined whether emergent hybrid (organizational) logics influenced multiple disconnected partnerships and collaborations. Thematic analyses were conducted on data from 39 semi-structured interviews conducted in two phases (n = 11 and n = 28, respectively). The interviewees were from the public, private, academia, and faith-based sectors and included interventions that impacted food insecurity, education, health, the built environment, crime, and substance and alcohol abuse. The findings showed the importance of trust as a hybrid logic impacting collaborations at multiple levels; we link this to additional findings on the level of structural embeddedness in the studied neighborhoods. The findings support the need for public health and community leaders to address gaps in trust/embeddedness in order to improve the success of community interventions. Practitioners and future researchers can apply the concept of hybrid institutional logics in the analysis of neighborhood collaborations, especially when there are multiple collaborations involving partners from different sectors. © The Author(s) 2020.","community partnerships; embeddedness; hybrid logics; social determinants; trust","alcohol abuse; article; built environment; clinical article; crime; education; food insecurity; human; leadership; logic; neighborhood; physician; public health; semi structured interview; social determinants of health; substance abuse; thematic analysis; trust"
"https://www.scopus.com/inward/record.uri?eid=2-s2.0-85113377573&doi=10.1080%2f15228916.2021.1954447&partnerID=40&md5=262c473444231a3bf5861fd722f29b2f","The achievement of business sustainability is dependent on the interacting components of the entrepreneurship ecosystem (EE) and institutions that support or challenge the business environment. Given the importance of the informal economy in developing economies, we need to rethink how to start an informal entrepreneurial revolution. This article examines the nexus of the informal entrepreneurial ecosystem, from the perspective of ecological resilience. Specifically, the article analyzes the significant differences between the formal sector, the informal sector, frugal innovations, and the supportive ecosystem resilience that produces unparalleled enthusiasm. Conceptually, this article developed propositions and a model of Productive and Unproductive EE explaining the business environment and the interacting predictors from the African regional context. Arguably, as entrepreneurial education and skills increases, there is more likelihood of the creation of formal ventures and growth-oriented micro, small and medium enterprises (MSMEs). These have implications for economic growth and–in the case of African economies–moving the informal to formal economy. © 2021 The Author(s). Published by Informa UK Limited, trading as Taylor & Francis Group.","African economies; ecosystem resilience; entrepreneurial revolution; frugal innovation; Informal entrepreneurship ecosystem; productive and unproductive ecosystems","Africa; ecosystem resilience; entrepreneur; informal sector; innovation; productivity; small and medium-sized enterprise; sustainability"
"https://www.scopus.com/inward/record.uri?eid=2-s2.0-85104458214&doi=10.4324%2f9781003052135&partnerID=40&md5=be19ffdc79755f0ad90bce4d9f0fbeb9","Strategic Cultural Center Management focuses on private cultural centers and their operational preconditions. The aim is to illustrate how to strategically manage a cultural center in varied external environments Analysing processes of organizational change, the author uses institutional and resource dependence theories alongside concepts such as business models, profitability, mission focus and quality management. The book examines theoretical and managerial implications, highlighting that cultural managers lean towards different strategies that diversify resource streams, facilitating agile strategic responses to institutional pressures. Offering valuable theoretical, empirical and conceptual analysis, this book serves as an incomparable reference for researchers, postgraduate students, civic leaders and arts managers involved in the creative and cultural industries. © 2021 Tomas Järvinen.","",""
"https://www.scopus.com/inward/record.uri?eid=2-s2.0-85116858941&doi=10.1016%2fj.jbusvent.2021.106162&partnerID=40&md5=3450d51885296623c170abdc6a3024ee","When do entrepreneurs in emerging markets seek out help from organizational sponsors? Problemistic search theory suggests that entrepreneurs will seek out sponsors in moments of venture distress. However, this theory was developed in the context of large organizations; it is not clear how it might apply to entrepreneurs in resource-constrained contexts. We use three inductive studies conducted in favelas in Brazil to examine when entrepreneurs seek help. Consistent with problemistic search theory, we find evidence that entrepreneurs seek out help from organizational sponsors in moments of venture distress. We also explore what types of entrepreneurs are most likely to seek help in a situation of venture distress and find that entrepreneurs who are more socially embedded and have more social obligations are more likely to take up sponsorship services, leading to important heterogeneity in our results on take-up. We find that women, more mature ventures, and middle-aged entrepreneurs are all more likely to engage in problemistic search. We contribute to a more contextualized theory of problemistic search for small entrepreneurs in emerging markets. We also provide important theoretical and practical insights about the demand-side of organizational sponsorship. © 2021","Emerging economies; Failure; Help seeking; Organizational sponsorship; Problemistic search; Venture distress",""
"https://www.scopus.com/inward/record.uri?eid=2-s2.0-85064266665&doi=10.1007%2fs11187-019-00171-8&partnerID=40&md5=ae53d854ea884997e17aaf38dcf41812","Despite the depth and breadth of the existing literature on university entrepreneurship, research has focused almost exclusively on licensing patents and founding spin-offs by faculty and staff. In comparison, much less evidence has been produced on start-ups created by students and graduates, mainly due to a lack of comprehensive data. This paper evaluates the impact of education—academic subject and foreign education experience—on the creation of firms by university graduates. In terms of the academic subject, the focus is on the distinction between science, technology, engineering, and math (STEM) fields and non-STEM fields. With respect to foreign education experience, the focus is on graduates’ experience studying outside their home country. Our analysis extends the scope of existing research in two ways. First, we consider the entire education history of graduates, not just from the researched university. Second, the paper extends the traditional focus on international students and analyzes the foreign education experience of both domestic and international students. The results indicate a positive relationship between having a non-STEM degree and entrepreneurial activity. A combination of STEM and non-STEM degrees is also positively related to the entrepreneurial propensity of graduates. Students with foreign education experience are significantly more likely to become entrepreneurs than those without such experience. Many governments focus their policy on attracting and retaining foreign students, especially those with degrees in STEM fields. Our results suggest that it is more important for a government to focus on both foreign-born students and domestic students who have foreign study experience. © 2019, Springer Science+Business Media, LLC, part of Springer Nature.","Entrepreneurship; Foreign education; Policy; STEM",""
"https://www.scopus.com/inward/record.uri?eid=2-s2.0-85102660860&doi=10.1371%2fjournal.pone.0247609&partnerID=40&md5=704544bf157eb3edf8e7f5d831e192a7","Entrepreneurship activity varies significantly across cities. We use the novel data for 1,652 ecosystem actors across sixteen cities in nine developing and transition economies during 2018–2019 to examine the role that institutional context plays in facilitating the productive entrepreneurship and reducing the unproductive entrepreneurship. This study is the first to develop and test a model of multi-dimensional institutional arrangements in cities. It demonstrates that not just that institutions matter in shaping the entrepreneurship ecosystem in cities, but in particular those institutional arrangements enhancing the productive and reducing unproductive entrepreneurship. Our findings suggest that differences between normative, cognitive, and regulatory pillars are associated with variance in both types of entrepreneurship in cities. For the formation of productive and high-growth entrepreneurs, all three pillars of institutional arrangement matter. For unproductive entrepreneurship normative pillar of institutions and the role of civil society matter most. This study has theoretical and practical implications for entrepreneurship ecosystem policy in cities. © 2021 Audretsch et al. This is an open access article distributed under the terms of the Creative Commons Attribution License, which permits unrestricted use, distribution, and reproduction in any medium, provided the original author and source are credited.","","Cities; Developing Countries; Economics; Efficiency; Entrepreneurship; Government Regulation; Humans; Inventions; Models, Econometric; article; city; ecosystem; entrepreneurship; human; human experiment; multicenter study; theoretical study; city; developing country; economics; government regulation; invention; legislation and jurisprudence; organization and management; productivity; statistical model"
