"Link","Abstract","Author Keywords","Index Keywords"
"https://www.scopus.com/inward/record.uri?eid=2-s2.0-85149702113&doi=10.3389%2ffpsyg.2023.1129495&partnerID=40&md5=196d4a1d08d6ef9b613669b8e30f5c29","Introduction: College entrepreneurship education should not only cultivate a group of college students who have strong willingness to start a business immediately after graduation, but also pay attention to future entrepreneurship success of college students. Correspondingly, in addition to attaching importance to improving college students’ entrepreneurial intention, college entrepreneurship education should pay attention to improving college students’ entrepreneurial calling. At present, there is insufficient research on the association between entrepreneurial role models and entrepreneurial calling. We aim to study the mechanism and boundary condition of the association between entrepreneurial role models and entrepreneurial calling. Methods: A longitudinal survey was distributed among 519 students from 16 colleges and universities in China. In the survey, the college students answered questions on entrepreneurial role models, entrepreneurial calling, entrepreneurial perceived behavioral control and entrepreneurial hands-on practice. Hierarchical regression was conducted, testing the association between entrepreneurial role models and entrepreneurial calling of college students, mediated by entrepreneurial perceived behavioral control and moderated by entrepreneurial hands-on practice. Results: Therefore, based on the social learning theory, the theory of planned behavior and the entrepreneurial event model, and by hierarchical regression of the data, this study confirmed that entrepreneurial role models were positively associated with college students’ entrepreneurial calling by partially mediating with entrepreneurial perceived behavioral control. Moreover, Entrepreneurial hands-on practice positively moderated not only the relationship between entrepreneurial perceived behavioral control and entrepreneurial calling, but also the mediating association of entrepreneurial perceived behavioral control between entrepreneurial role models and entrepreneurial calling. Discussion: This study not only enriches the theoretical research on entrepreneurial calling and entrepreneurial role models, but also provides valuable educational enlightenment for colleges and universities to improve the students’ entrepreneurial calling. Copyright © 2023 Jin, Liu, Zhang and Wen.","entrepreneurial calling; entrepreneurial hands-on practice; entrepreneurial perceived behavioral control; entrepreneurial role models; entrepreneurship education",""
"https://www.scopus.com/inward/record.uri?eid=2-s2.0-85135040894&doi=10.1111%2fisj.12403&partnerID=40&md5=2041e575ed4e17fcec182b3bfe95b9d1","While there have been increasing studies on the impact of financial technology (FinTech), limited research has explored how FinTech supports economic empowerment for informal businesses. Drawing on institutional logics and a case study of mobile money—a FinTech innovation—this study develops a model of mobile money-driven economic empowerment. We argue that this model is important to explain how those at the bottom of the economic pyramid, who are often neglected, use FinTech innovations to create and run informal businesses. Our findings and model explain the dynamics between logics, actors, and mobile money at three levels: regulatory, payments infrastructure, and informal economy. We identify three corresponding effects as outcomes of economic empowerment for informal businesses: greater access to start-up capital, new employment opportunities, and improved financial management. By illustrating these effects, our study contributes to a better understanding of how FinTech innovations offer a possible pathway to economic empowerment for informal businesses. © 2022 The Authors. Information Systems Journal published by John Wiley & Sons Ltd.","economic empowerment; FinTech; ICT4D; informal businesses; institutional logics; sustainable development goals","Economic and social effects; Electronic money; Case-studies; Economic empowerment; Financial technology; ICT4D; Informal business; Institutional logic; Sustainable development goal; Technology innovation; Technology support; Three-level; Economic analysis"
"https://www.scopus.com/inward/record.uri?eid=2-s2.0-85151929520&doi=10.1108%2fIJEBR-07-2022-0640&partnerID=40&md5=c3870007da3150332681be98fbda0224","Purpose: This study holds the objective of evaluating the impact of formal (e.g. ease of doing business score, start-up procedures to register a business, property rights) and informal (e.g. school life expectancy, collaboration between companies and human capital) institutions on the economic performance of countries in conjunction with the mediating effect of entrepreneurial activities and social performance. Design/methodology/approach: The authors collected quantitative, secondary data from a range of different sources, specifically the World Bank (WB), Global Entrepreneurship Monitor (GEM), World Economic Forum (WEF), Freedom House (FH) and Doing Business (DB) for the years between 2016 and 2018. The authors deployed a quantitative approach based on estimating structural equation models according to the Partial Least Squares (PLS) method. Findings: The authors find that institutions, whether formal or informal, impact positively on economic and social performance with entrepreneurial activities positively mediating the relationship between informal institutions and economic performance and social performance. Practical implications: The study research holds key implications for strengthening institutional theory. The authors find that our empirical results draw attention to the impact that institutions and their functioning can have on economic performance. Through this alert, the authors aim for researchers, politicians and other diverse decision-makers involved in public policies to prioritise not only the good working of institutions but also fostering entrepreneurship, in order to boost the resulting economic performance. Originality/value: The study research contributes to the literature by testing the model that links institutions, entrepreneurial activity and economic performance. The authors also help policymakers to become aware of the importance that the quality of institutions has on entrepreneurial activity, and, consequently on economic performance. © 2023, Emerald Publishing Limited.","Economic performance; Entrepreneurship; Formal institution; Informal institution; Institutional theory",""
"https://www.scopus.com/inward/record.uri?eid=2-s2.0-85148938566&doi=10.1108%2f9781803821597&partnerID=40&md5=4f0bec1da962e2edc78a3a7ee18503f6","Providing invaluable support for construction in determining the acceptable practice and standard for regulatory bodies and managers, Construction Supply Chain Management in the Fourth Industrial Revolution Era also appeals to researchers as it expands the frontiers of knowledge in the fourth industrial era. © 2022 Emerald Publishing Limited.","",""
"https://www.scopus.com/inward/record.uri?eid=2-s2.0-85144155041&doi=10.3389%2ffsufs.2022.915571&partnerID=40&md5=3e360bba102e7b70494ce8a22be25a03","Short Food Supply Chains (SFSC) has drawn scholarly attention for its innovative features, such as the emergence of new associational forms, proximal relations and new quality conventions. A better understanding of SFSC is attained when looking at it as alternative food networks structured around organizational relationships. Aiming toward a comprehensive conceptualization of SFSC, this paper presents the findings of a transnational empirical investigation of different cases in a search of their central and most typical features. Building upon the Community of Practice (CoP) concept, SFSC are conceptualized as co-creative processes and as constructed realities with their traits being shaped by the interaction of participating multiple-actors. The sample of this study involves nine CoPs which are located in different parts of Europe and which were studied through open space discussions (World Café) with the participation of the various actors involved in the chain from production to consumption, services, research and policy areas. The identification of the most typical and ubiquitous attributes of SFSC as they appear across different contexts is based on an exploratory analysis which defines the main frames of SFSC and identifies on their basis the pillars of the conceptualization of SFSC. These pillars are sharing, authenticity and sustainability, the first one referring to the relational aspect, the second referring to the commercialization process and the third relating to the rationale or underlying logic of SFSC. The identified pillars signify their competitive advantage because SFSC develop as dynamic alternative networks to conventional, large-scale food systems. It is envisaged that the suggested conceptualization of SFSC would contribute to a better understanding of SFSC and foster future research in this field. Copyright © 2022 Petropoulou and Paschou.","co-creation; Community of Practice; Europe; multi-actor approach; SFSC",""
"https://www.scopus.com/inward/record.uri?eid=2-s2.0-85131540539&doi=10.1108%2fIJEBR-02-2022-0109&partnerID=40&md5=33a21ca7be72368fe6384a6deb172d77","Purpose: Entrepreneurial intentions have traditionally been linked to an entrepreneur's personal ability to take advantage of opportunities. Yet, entrepreneurs' perceptions of contextual factors, which extend beyond one's control, deserve equal attention. This paper looks at the role played by cultural intelligence and the institutional environment in shaping entrepreneurial intentions. Design/methodology/approach: The role played by cultural intelligence in entrepreneurial intentions and the mediating role played by the institutional environment were studied quantitatively by analyzing 224 young potential entrepreneurs who had participated in a business plan competition. This study used cross-sectional data, developing an original full collinearity assessment approach to check for any common method bias. Findings: This study reveals a positive relationship between cultural intelligence and entrepreneurial intentions. Likewise, any favorable perceptions of the institutional environment tend to increase the probability of engaging in entrepreneurship and further strengthen the positive effect of cultural intelligence on entrepreneurial intentions. Originality/value: This study provides a holistic view of the relationship between the entrepreneur and the context in which ventures are created, explaining the role played by cultural intelligence in entrepreneurship based on evidence drawn from a developing country. This contributes to a critical reflection on personal and environmental factors and the antecedents of entrepreneurial intentions. © 2022, Emerald Publishing Limited.","Creativity; Entrepreneurial intention; institutional theory; Institutions",""
"https://www.scopus.com/inward/record.uri?eid=2-s2.0-85156186240&doi=10.1007%2fs11187-023-00775-1&partnerID=40&md5=104b8133eba880ebe49681bfae60449f","Rendering four emotional competencies of the trait emotional intelligence model, well-being, self-control, adaptability, and sociability as culturally contextualized societal psychological capital, we explain their cross-cultural comparative influences on social and commercial entrepreneurship. We use psychological capital theory to establish emotional intelligence as one’s emotional competencies. Societies with an augmented supply of individuals with such competencies will have higher reserves of positive psychological capital making emotional intelligence as culturally contextualized that shape both commercial and social entrepreneurship. Using 30,924 responses from the Global Entrepreneurship Monitor (GEM) survey of 24 countries and supplementing data from World Values Survey (WVS), our multilevel analyses show that societal eudaimonic well-being and sociability increase the likelihood of social entrepreneurship more than commercial entrepreneurship whereas societal hedonic well-being, adaptability, and self-control increase that of commercial entrepreneurship more than social entrepreneurship, implying that culturally contextualized emotional intelligence shapes commercial and social entrepreneurship differently across nations. Our findings offer policy implications for country-specific programs that tap into societal emotional competencies for entrepreneurship pedagogy, sustainability goals, and emotional intelligence-based training for entrepreneurs. © 2023, The Author(s), under exclusive licence to Springer Science+Business Media, LLC, part of Springer Nature.","Adaptability; Entrepreneurship; Self-control; Sociability; Well-being",""
"https://www.scopus.com/inward/record.uri?eid=2-s2.0-85133924144&doi=10.1108%2fSGPE-09-2021-0068&partnerID=40&md5=5080e47a4e5321a3cef4f7b605bf606c","Purpose: There is pressure to transform graduate education in ways that better prepare and socialize students for academic careers that require entrepreneurial activities and/or professional pathways outside of academia. The inclusion of entrepreneurial learning in graduate curricula and programs is one strategy for responding to such calls. Yet, there lacks an understanding of how graduate students outside of the business fields make sense of entrepreneurial content relevant to their academic interests and career aspirations. Thus, the purpose of this paper is to explore entrepreneurial sensemaking by non-business graduate students enrolled in a transdisciplinary entrepreneurship course. Design/methodology/approach: A single case study design was used to explore how seven nonbusiness graduate students in a transdisciplinary entrepreneurial leadership course made sense of entrepreneurial content relevant to their academic interests and career aspirations. Data were collected through direct observations, semi-structured interviews and the administration of an entrepreneurial leadership proclivity assessment tool. Findings: Through experiential learning intentionally centering entrepreneurship, graduate students acquire entrepreneurial knowledge in ways that enhance their agency and sense of empowerment without diluting or overriding their academic and/or professional intentions. Practical implications: Sensemaking is framed as a pedagogical resource for fostering the integration of entrepreneurial content in transdisciplinary graduate courses and experiences in ways that align with and support the academic interests and career aspirations of individual students. Originality/value: A novel entrepreneurial sensemaking approach to the integration of entrepreneurial content with transdisciplinary curricula that is directly responsive to calls for graduate education transformation is introduced. © 2022, Emerald Publishing Limited.","Agency; Entrepreneurship education; Graduate education; Sensemaking",""
"https://www.scopus.com/inward/record.uri?eid=2-s2.0-85122251730&doi=10.1016%2fj.iedeen.2021.100187&partnerID=40&md5=e2103ea1ac089810aa0456e2ae957535","A country's institutional framework plays a crucial role in promoting entrepreneurship, which drives economic growth. Encouraging a minimum level of certainty in ambiguous environments characterized by risk taking is important. Aware of this importance, we analyze the influence of institutional factors on entrepreneurship development. Specifically, we analyze political stability, government effectiveness, regulatory quality, a robust rule of law, the ease of starting a new business, and the ease of obtaining credit. We develop two models to explain the presence and absence of entrepreneurship. To do so, we apply qualitative comparative analysis (QCA) to a sample of 48 countries using data sourced from the Global Entrepreneurship Monitor and the Global Innovation Index. The results show that the effect of institutional factors on the level of entrepreneurship varies according to the socioeconomic characteristics of each country. They suggest that a wide range of institutional configurations lead to the presence or absence of entrepreneurship. Although entrepreneurship can be found in unfavorable institutional environments, future research should examine how to formalize such environments as a standardized institutional configuration to shift from necessity to opportunity entrepreneurship. Achieving this shift is relevant for innovation and economic development. © 2021 The Author(s)","Credit; Economic development; Entrepreneurship; Government; Institutional theory; Regulation",""
"https://www.scopus.com/inward/record.uri?eid=2-s2.0-85129624903&doi=10.1108%2fIJIS-08-2021-0159&partnerID=40&md5=280611f957639824c116e877bba8bad8","Purpose: This study aims to highlight the negative effects of innovation with regard to innovation typologies and human, organizational, economic and societal variables in local authorities. Design/methodology/approach: To achieve the above objective, radial basis function, based on Softmax activation function, and partitioning variable, is applied on a sample of Moroccan local authorities. Findings: The findings show that the typologies of innovation that significantly impact the aforementioned variables are standard innovation/tailor-made innovation, social innovation/commercial innovation and incremental innovation/breakthrough innovation. They also reveal that the modalities considerably impacted by innovation are deviance in reaction, procedural injustice, increase of hidden costs and negative effect on ethics-culture. Originality/value: To the best of the authors’ knowledge, this study is original in that it can contribute to the research in the field of innovation, as it deals with its negative effects in terms of typologies, which are rarely processed in innovation research. Additionally, to overcome these negative effects, this work uses neural networks that are very scarcely used in such studies on innovation. © 2022, Emerald Publishing Limited.","Influential innovation typologies; Local authorities; Modalities impacted by innovation; Negative effects of innovation; Radial basis function","Functions; Activation functions; Base function; Design/methodology/approach; Influential innovation typology; Local authorities; Modality impacted by innovation; Negative effect of innovation; Organizational economics; Radial base function; Radial basis; Radial basis function networks"
"https://www.scopus.com/inward/record.uri?eid=2-s2.0-85146236388&doi=10.1108%2fK-09-2022-1353&partnerID=40&md5=064a69f572a693fa325d942908150a33","Purpose: This study aims to explore the role of the green market (GM) and green innovation (GI) towards green entrepreneurship (GE) and sustainable development (SD). Design/methodology/approach: Based on cross-sectional data, the researchers used quantitative methods in this study to confirm the conceptual framework. The researchers used a questionnaire to collect the data obtained from Pakistan's knowledge-based companies (KBCs). In total, the researchers used 192 usable samples to deliver the findings. Findings: The researchers used structural equation modeling (SEM) to ensure the model's fitness and as a basis for this study's hypotheses. The findings highlight that the GM factors, such as green product (GP), green design (GD), green supply chain (GSC) and green production (GPN) have a positive and significant effect GM factors, such as on both GE and SD. Further, GI is, also, a significant predictor of GE and SD. Finally, this study's findings show that GE has a predictive role of towards SD. Practical implications: This study's findings create a source of attention for individuals to preserve the GM's natural resources. Further, mainly in developing contexts like Pakistan, the addition of the GI factor and the GM towards GE and SD contribute to the depth of the existing literature. Originality/value: By integrating factors, such as innovation toward GE and SD, this study's findings provide an original contribution to the empirical evidence. © 2022, Emerald Publishing Limited.","Green entrepreneurship (GE); Green innovation; Green market (GM); Pakistan's knowledge-based companies; Sustainable development (SD)","Commerce; Knowledge based systems; Product design; Supply chains; Green entrepreneurship; Green innovations; Green market; Green markets; Knowledge-based companies; Market innovation; Market-factors; Pakistan; Pakistan knowledge-based company; Sustainable development; Sustainable development"
"https://www.scopus.com/inward/record.uri?eid=2-s2.0-85162166045&doi=10.1016%2fj.jclepro.2023.137761&partnerID=40&md5=750f4a40545cb567db93203e5eedf324","Sustainability leadership (SL) is a complex and relevant phenomenon that can contribute to several types of organisations during the process of becoming more sustainability-oriented. Over the past few years, a considerable number of publications have increased the level of knowledge in this field; however, on the other hand, it also has generated more complexity, literature dispersity and lack of complete understanding of the possible research avenues on SL. This paper aims to address this by complementing and building on previous qualitative and quantitative studies of SL by unveiling and exploring the landscape of the research field. This study differs from prior research in three main ways: (1) explores how the term SL evolved from the leadership theory, (2) explores the research streams that scholars have been conducting in the field by adopting a robust search string revised by specialists and considering a wide range of terms related to formal and informal leadership, as well as sustainability-related terms and (3) understands how the several leadership theories and styles are connected to sustainable development (SD) and corporate social responsibility (CSR). After applying the inclusion and exclusion criteria, a total of 1,813 well-cited papers published in top journals that directly tackle sustainability leadership were selected. This sample was then used for the bibliometric assessment based on the co-occurrence of terms technique. The results indicate the existence of four main clusters and twelve subclusters, which can be considered research strands. In addition, this study also explores how the selected studies build on several leadership theories in order to understand how leadership aspects can contribute to SD and CSR adoption. © 2023 Elsevier Ltd","Bibliometric analysis; Corporate social responsibility; Corporate sustainability; Responsible leaders; Sustainability leadership","Bibliometrics analysis; Conceptual foundations; Conceptual research; Corporate social responsibility; Corporate-sustainability; Dispersity; Leadership theory; Qualitative study; Responsible leader; Sustainability leadership; Sustainable development"
"https://www.scopus.com/inward/record.uri?eid=2-s2.0-85160215571&doi=10.1093%2fscipol%2fscac066&partnerID=40&md5=38b8bedb4a17354d36c6e73329b014e5","A striving for research excellence and the implementation of third mission activities in the form of technology transfer have become standard practices at modern higher education institutions. The recent call for universities to include social innovation in their third mission and the apparent lack of involvement of universities in this area indicate that social innovation is not yet perceived as a legitimate activity by the academic community. We examine why this is the case and disentangle the legitimation journey of social innovation in research-intensive environments.  © 2022 The Author(s).","legitimacy; social innovation; third mission","higher education; implementation process; innovation; policy implementation; social development; technological change; technological development"
"https://www.scopus.com/inward/record.uri?eid=2-s2.0-85148075018&doi=10.1007%2fs11846-023-00626-z&partnerID=40&md5=70f12d97ae53e60b9ba0e36df5e14223","This study aims to examine the effect of institutions on entrepreneurial intentions, the mediation of individual motives in this relationship, and the moderating effect of the country. We tested a sample of 678 questionnaires using quantitative research methods. We used confirmatory factor, correlation, multiple regression, mediation, and moderated mediation analyses to analyze the data. Findings show that normative institutions affect entrepreneurial intentions in Turkey and Kosovo. They also reveal that the personal attitude, subjective norm, perceived behavioral control, and need for achievement have a full mediation relationship between regulatory institutions and entrepreneurial intentions and a partial mediation relationship between normative and cultural-cognitive institutions and entrepreneurial intentions. Finally, we found no moderating effect of the country in the relationship between institutions and entrepreneurial intentions. The study contributes to the literature and provides policy and managerial implications on the macro and micro factors that affect entrepreneurial intentions in developing and transition economies. © 2023, The Author(s), under exclusive licence to Springer-Verlag GmbH Germany, part of Springer Nature.","Entrepreneurial intentions; Institutional theory; Macro-micro variables; Need for achievement; Theory of planned behavior",""
