"Link","Abstract","Author Keywords","Index Keywords"
"https://www.scopus.com/inward/record.uri?eid=2-s2.0-85162958674&doi=10.1177%2f09504222231173953&partnerID=40&md5=79cbd8aa74235e83b23ba11e95526e60","This article presents findings on factors hindering academic employees from becoming involved in collaboration activities. Based on survey data, we map out perceived barriers to collaboration whereby five categories emerge: teaching obligations, partner (dis)interest, partners’ resources, academic freedom, and university resources. By means of multiple regression analysis, we examine the extent to which individual, intra-, and inter-organisational factors explain these perceived barriers to collaboration. The study was carried out in Iceland, where university objectives are still heavily based on teaching activities, and few entrepreneurial activities take place in academia. Our results reveal that age and academic disciplines play a main role in the perceptions of academics regarding barriers to collaboration, especially when it comes to barriers grounded in teaching obligations or university resources. Most perceived barriers are based on the internal level that is lack of resources on behalf of universities. The study, therefore, provides a new perspective relative to earlier findings that have indicated that barriers to collaboration exist mostly at the individual level. We conclude that academic institutions can play a more prominent role in the activation of third mission activities than they have been doing so far. © The Author(s) 2023.","academic engagement; barriers; third mission; University-industry collaboration",""
"https://www.scopus.com/inward/record.uri?eid=2-s2.0-85125007356&doi=10.1016%2fj.techfore.2022.121573&partnerID=40&md5=c165bb5909fb5aee0db1e9da27bb0fe6","In this article we pay attention to the different analytical layers that compose the managerial context of university-industry relationships – a cornerstone of entrepreneurial universities. Specifically, we address the dynamics of joint university-industry laboratories, a typical example of high-quality engagement between academia and industry. Joint university-industry laboratories are understood as long term joint undertakings shared by universities and industry targeted at generating value for all parties involved through various channels. Given the different missions of universities and industry, joint laboratories inherit special challenges for management. Our exploration therefore outlines four complementary dimensions of interest in this context: the macro environment, university-level institutional challenges, strategic context and, lastly, we deal with individual-level aspects when analyzing identity issues involved in the dynamics of joint university-industry labs. A research agenda is derived from these explorations. © 2022 Elsevier Inc.","Ecosystems of innovation; Entrepreneurial universities; Laboratories; University-industry collaboration","Dynamics; Ecosystem of innovation; Entrepreneurial university; High quality; Macro-environment; Multi-layered; University industries; University levels; University-industry collaboration; University-industry relationships; Various Channels; entrepreneur; innovation; laboratory method; university sector; Laboratories"
"https://www.scopus.com/inward/record.uri?eid=2-s2.0-85144738398&doi=10.3390%2fadmsci12040176&partnerID=40&md5=e07b551447f53c815acc71e2c2c69c74","The influences of personality traits and business barriers on entrepreneurial behaviour have been studied by numerous researchers. However, the mechanisms by which changes in institutional contexts and personality traits affect individuals’ entrepreneurial motivation have not received enough attention from researchers. This paper aims to fill this gap in the literature by examining the joint effects of personality traits and business barriers on one’s motivation to engage in entrepreneurial activity. A structured questionnaire was developed to capture the above linkages. To measure the latent variables, factor and reliability analyses were utilised. To examine the relationships, a regression analysis was performed on a unique dataset of respondents from three counties: Czechia, Hungary, and Serbia. The results show that personality traits positively influence motivation towards entrepreneurship. Furthermore, external barriers (ecological and technological issues), and infrastructure factors positively affect entrepreneurial motivation. From an academic viewpoint, personality traits and motivation to engage in entrepreneurial activity can be nourished by education, highlighting the role of universities in this regard. Our paper’s findings should trigger the interest of policymakers who aim to introduce new instruments or change the existing ones (designing policies) to boost entrepreneurship. © 2022 by the authors.","business barriers; Czechia; entrepreneurial motivation; entrepreneurship; Hungary; infrastructure; personality traits; Serbia",""
"https://www.scopus.com/inward/record.uri?eid=2-s2.0-85153787310&doi=10.3390%2fsocsci12040215&partnerID=40&md5=564bac517f410ae0a995e0ce3342d29f","National innovation systems (NIS) are generally perceived as a set of interconnected organizations (or structures) that domestically produce and commercially implement scientific knowledge and technology. The development of any national innovation system is the key element for shaping up the scientific values in every country. Our paper identifies the trends in global innovation and technological scope associated with the formation of global economic relations, global investment, the flow of knowledge, technology, increased internationalization of R&D, and the formation of global innovation networks. In addition, it attempts to trace the relationship between instrumental values associated with the perception of science and technology and the development of NIS within the context of sustainable economic development using a case study from Russia. The paper carries out the analysis of values on the basis of the World Values Survey (WVS), as well as statistical indicators characterizing the development of the national innovation system. The obtained quantitative results stemming from our empirical model are further refined with the help of qualitative research, including the narrative economics approaches. Our results might be beneficial for the stakeholders and policymakers working with innovation policies and approaches in business, economics, and education. © 2023 by the authors.","innovations; national innovation system; scientific values; social norms; sustainable economic development",""
"https://www.scopus.com/inward/record.uri?eid=2-s2.0-85153042335&doi=10.1007%2fs11846-023-00658-5&partnerID=40&md5=6a450628858a2046e5daa90435d38cc4","Two important lines of research come together in this paper: entrepreneurship and corporate social responsibility (CSR). Both stand out for their ability to contribute to sustainable development and generate competitive and social advantages. This study combined both approaches under the concept of CSR entrepreneurship (CSRE). A scale was developed to assess corporate socially responsible entrepreneurs’ traits in corporate contexts (i.e., CSRE-s). This quantitative measurement instrument was initially composed of 84 items, which were subjected to various validity and reliability tests. Exploratory factor and confirmatory factor analyses were conducted to identify the most significant determinant variables of individuals engaging in CSRE. The validated CSRE-s indicates that the corporate socially responsible entrepreneurship construct involves 6 entrepreneurship factors and 3 CSR dimensions—environmental, social, and economic—with 2 factors each (i.e., 6 factors), assessed by a total of 76 items. This research’s main contribution is the identification of CSRE features in entrepreneurs that together constitute an original, unique, and innovative framework for a sustainable development approach to entrepreneurship. The proposed conceptual model can be used to ensure the CSR values validated for the CSRE-s are incorporated into entrepreneurial training programs (i.e., universities), the public sector’s policies promoting entrepreneurship, and strategic business plans for expansion via entrepreneurship. The CSRE-s can be used to strengthen these three areas simultaneously, which should provide social advantages to all stakeholders via the sustainable management of entrepreneurial projects. © 2023, The Author(s).","Confirmatory factor analysis; Corporate social responsibility; Entrepreneurship; Exploratory factor analysis; Spain",""
"https://www.scopus.com/inward/record.uri?eid=2-s2.0-85151407410&doi=10.1108%2fMD-07-2022-0914&partnerID=40&md5=99703983c9cba26fad9ab05d1e8ac42b","Purpose: The purpose of this study was to explore the influence of entrepreneurial attitudes, motivation and orientation on the entrepreneurial competitive advantage of innovative entrepreneurs in the tourism and hospitality industry, including those involved with bed and breakfasts, travel agencies and restaurants. Design/methodology/approach: First, the sample for this study was selected through news media reporting on well-known new entrepreneurs, from lists of those entrepreneurs who have won innovation entrepreneurship loan subsidies from the government and from lists of those who have won innovation awards. Second, a pretest was used to confirm the feasibility of the questionnaire. The pretest survey was distributed to a total of 150 tourism and hospitality entrepreneurs. A total of 8 dimensions/facets and 36 items were confirmed. Finally, data collection took place for 9 months. A total of 1,150 questionnaires were distributed, and 606 questionnaires were recovered. Findings: This study proposes a new multi-integration model of moderation-mediation analysis. The innovative business model explores the relationship between entrepreneurial factors and competitive advantage. Based on a survey of 606 staff members and managers of tourism and hospitality firms, entrepreneurs in the tourism and hospitality industry with entrepreneurial attitudes and motives had opportunities to increase their entrepreneurial orientation. Practical implications: In the process of innovative entrepreneurship, whether through organizational learning or other enterprise cooperation, it is necessary to pay more attention and propose different environmental management strategies. In addition, this study also found that marketing uncertainty moderates between entrepreneurial attitudes and entrepreneurial motives. Entrepreneurial motives are more conservative than other motives, and there is increased confidence in investing in innovative entrepreneurship in stable environments. Originality/value: This study indicates that innovative entrepreneurial tourism and hospitality firms have a mediating or moderating effect on the relationship between entrepreneurial attitudes and positional advantage. If used properly, these resources can help the new entrants in the tourism and hospitality sector avoid the limitations of environmental change, firm size or insufficient information and improve their competitive advantage. © 2023, Emerald Publishing Limited.","Competitive advantage; Entrepreneurial alertness; Entrepreneurial motives; Entrepreneurial orientation; Market uncertainty",""
"https://www.scopus.com/inward/record.uri?eid=2-s2.0-85122063169&doi=10.1108%2fIJSHE-04-2021-0162&partnerID=40&md5=14323b720168ba42ebde348669967851","Purpose: Considering the vital role of higher education institutions (HEIs) in accomplishing sustainable development goals, this study aims to examine how and when sustainable leadership (SL) influences sustainable performance by examining social innovation (SI) as a mediating mechanism and managerial discretion (MD) as a boundary condition based on upper echelon theory. Design/methodology/approach: This study is cross-sectional in nature. The authors adopted a cluster-sampling approach to collect data from 500 employees of HEIs in Pakistan and China. The response rate for this study was 52.63%. As the proposed model is complex, the authors used structural equation modeling (SEM) to analyze the research hypothesis. Findings: The empirical findings confirm the presence of SI as a competitive partial mediator between SL and sustainable performance. Nevertheless, the findings of this study do not suggest a higher positive effect of SL on SI in the presence of high MD. Research limitations/implications: The study evaluated the role of SL and SI in fostering sustainable performance from the perspective of employees in HEIs in China and Pakistan. Before the empirical evidence can be generalized, there is a need to conduct similar studies in other parts of Asia and Western countries as well. Practical implications: This study presents implications for higher education leaders and policymakers at the national level to foster the sustainable performance of their institutions. Social implications: The current evidence reveals the effectiveness of SL in achieving the social goals of HEIs through SI. The recommendations presented in this study can have an impact on society, providing it with a sustainable future. Originality/value: This study is the first of its kind to examine the mediating role of SI on the relationship between SL and sustainable performance. The present study also provides pioneering empirical evidence about the negative effects of MD in the context of HEIs. © 2021, Qaisar Iqbal and Katarzyna Piwowar-Sulej.","Asia; Green leadership; Innovation; Sustainable development; Sustainable HRM; University",""
"https://www.scopus.com/inward/record.uri?eid=2-s2.0-85142169728&doi=10.1016%2fj.respol.2022.104667&partnerID=40&md5=8adc39a425ef75fa999ddbf3c90ddf33","The role of regional governments in fostering opportunity entrepreneurship has received increasing attention from both academics and practitioners. Drawing on research on entrepreneurial ecosystem (EE), this study provides a more analytical and holistic account of the supportive role of regional governments in underdeveloped institutional environments and their interactions with other key elements in regional EEs. I propose that in underdeveloped institutional environments, a regional government which is able to perform its core function of delivering public and social services is positively associated with the growth of opportunity entrepreneurship. This effect becomes stronger in regions with more market-based economies, higher education institutions (HEIs), an entrepreneurial culture, and social entrepreneurship. Empirical results based on entrepreneurship data at the provincial level in China between 1993 and 2013 provide strong support for the hypotheses. This study contributes to the literature on EE by providing more systematic evidence from underdeveloped institutional environments, and has policy implications for promoting opportunity entrepreneurship. © 2021 Elsevier B.V.","Entrepreneurial culture; Entrepreneurial ecosystems; HEIs; Market development; Opportunity entrepreneurship; Regional governments; Social entrepreneurship","Commerce; Public policy; Core functions; Entrepreneurial cultures; Entrepreneurial ecosystem; Higher education institutions; Key elements; Market development; Opportunity entrepreneurship; Regional government; Regional opportunities; Social entrepreneurship; Ecosystems"
"https://www.scopus.com/inward/record.uri?eid=2-s2.0-85161419408&partnerID=40&md5=c79ee729ae305f11e5e66ac4f1292c14","[No abstract available]","",""
"https://www.scopus.com/inward/record.uri?eid=2-s2.0-85166551855&doi=10.5465%2fannals.2021.0132&partnerID=40&md5=2c09f69d522f646287b89e82b56c7b2b","Indigenous Peoples and contexts have offered valuable insights to enrich management and organization theories and literature. Yet, despite their growing prevalence and impact, these insights have not been compiled and synthesized comprehensively. With this article, we provide a systematic and thorough analysis of Indigenous management and organization studies research published over a 90-year period (1932–2021), and synthesize this body of work into a multidimensional framework, exploring the various features and methodological considerations of Indigenous research. Our analysis reveals that the literature in the field remains fragmented and dispersed across many different subfields and publication outlets, making it challenging for researchers to aggregate, synthesize, and build upon prior works. Our framework integrates insights into recurrent themes and provides a common language to further advance this vital field of research. © Academy of Management Annals.","",""
"https://www.scopus.com/inward/record.uri?eid=2-s2.0-85144200052&doi=10.1108%2fIJCHM-04-2022-0461&partnerID=40&md5=3b85eecafa308ee06b468cb80322f878","Purpose: The major purpose of this research article is to empirically analyze a moderated-mediated model to comprehend the interrelationships between religiosity, life hardship, attitude toward social entrepreneurship (SE) and corporate social entrepreneurial orientation (SEO). Design/methodology/approach: The constructivist grounded theory method was used to analyze interviews, and partial least squares structural equation modeling was selected to analyze the developed nine hypotheses. Findings: Based on the structural model outcomes, the practicing religious believers reported a significantly higher level of corporate SEO and propensity for social proactiveness, innovativeness, risk-taking, socialness and persistence (dimensions of SEO) than the nonpracticing believers. Practical implications: This study provides the practical implication that social entrepreneurs with a higher degree of congruence with the prevailing religious institutionalized logic in a society have a higher inclination to create social value through corporate practices and operations. Originality/value: This study presents an SEO scale that incorporates the dimensions of two SEO scales developed by Kraus et al. (2017) and Syrjä et al. (2019). To the best of the author’s knowledge, the applicability and generalizability of this scale were supported for the first time in the SE discipline, particularly tourism SE. This scale effectively captures more characteristics of SE, particularly in the face of inefficient political and institutional forms. © 2022, Emerald Publishing Limited.","Corporate social entrepreneurship; Grounded theory; Moderated-mediated model; PLS-SEM; Religiosity",""
"https://www.scopus.com/inward/record.uri?eid=2-s2.0-85134656403&doi=10.1108%2fIJEBR-07-2021-0600&partnerID=40&md5=4c62ba3b4e6d366a9f83967d18cf3a4b","Purpose: Despite growing scholarly interest in academic entrepreneurship (AE) few studies have examined its non-commercial aspects and how it contributes to meeting grand societal challenges. One explanation for this may be the continuing focus of AE on intellectual property commercialization. This paper aims to address this knowledge gap by uncovering how universities can contribute to promoting non-commercial forms of AE. Design/methodology/approach: This paper uses the human capital theoretical lens to make its argument and applies it to data obtained from exploratory qualitative research (55 semi-structured interviews and nine focus groups) in the developing countries of Bolivia, Colombia and Ecuador. Findings: Universities can promote different forms of non-commercial AE even in the absence of sophisticated resources for innovation, through the stimulation of the specific human capital of the university community resulting from activities where they help others. Originality/value: This paper proposes a general framework for advancing theory development in AE and its non-commercial forms, based on data obtained in uncharted territories for AE. © 2022, Emerald Publishing Limited.","Academic entrepreneurship; Entrepreneurial orientation; Human capital; Social entrepreneurship; Social impact",""
"https://www.scopus.com/inward/record.uri?eid=2-s2.0-85131864244&doi=10.3389%2ffpubh.2022.832711&partnerID=40&md5=c27508a622743422f98f3877ff6b4404","Small- and medium-sized enterprises (SMEs) play an important role in sustainable development not only for their significant contribution to China's economy but also for their large share of total discharged pollutants. Despite the widely acknowledged importance and benefits of environmental management accounting (EMA), the level of adoption and implementation of EMA practice is still weak within SMEs in many countries, especially in China. The current systematic review aims to identify the barriers affecting the Chinese SMEs for adopting EMA practices along with the critical success factors required for adopting EMA practices by SMEs and their top management for ensuring sustainable corporate environmental performance in China. The study is carried out following the Preferred Reporting Items for Systematic Reviews and Meta-Analyses (PRISMA) guidelines. In total, 73 articles were found to be eligible to be included in the systematic review, which was published on EMA in small- and medium-sized enterprises in China. Our study aims to document barriers to the adoption of EMA among Chinese SMEs. The review concluded that strict legislation and the availability of flexible financing options for SMEs can promote the adoption of EMA by SMEs. The establishment of environmental reporting systems and auditing mechanisms can further increase the utilization of EMA by small and medium firms. Barriers to EMA adoption can be mitigated after careful consideration of the current situation in SMEs. Documentation of significant barriers may help to form supportive policies which ultimately add to the efforts toward climate change mitigation. Copyright © 2022 Javed, Yusheng, Iqbal, Fareed and Shahzad.","China; environmental management accounting (EMA); small and medium sized enterprises (SMEs); sustainable corporate environmental performance; systematic review","China; Conservation of Natural Resources; China; environmental protection"
"https://www.scopus.com/inward/record.uri?eid=2-s2.0-85107518354&doi=10.1002%2fsd.2218&partnerID=40&md5=c5ad4ab50bc0a71a395cec3b519ea1e8","Business schools have the potential to become an important driver for sustainable development (SD) by broadening their research assessments beyond scientific performance. Assessment frameworks that expand the scope from academic performance to actual contributions to SD can support business schools in this regard. This article addresses the current lack of pluralistic conceptualizations of research impacts and aims to propose an assessment framework and indicators for business school research impacts on SD. It thus investigates the contributions of business school research to the Sustainable Development Goals (SDGs) through an explorative case analysis of Vienna University of Economics and Business (WU Vienna) and grounded theory's constant comparative method. In doing so, it adds value to the discussion about the societal relevance of business schools and pluralistic assessments of their research impacts. The findings illustrate that business school research impacts the economy, policy making, and education by fostering organizational and systemic change and contributes to overcoming societal and environmental challenges. The proposed framework contributes to shifting the focus of research impact assessment of business schools toward SD. It shows that business schools must holistically recognize their impacts by considering key SD impact areas, impact scope and pathways, and their actual contributions to the SDGs. © 2021 The Author. Sustainable Development published by ERP Environment and John Wiley & Sons Ltd.","business schools; case study; grounded theory; higher education; research impacts; sustainability assessment; sustainability indicators; sustainable development goals","academic performance; comparative study; higher education; sustainability; sustainable development; Sustainable Development Goal"
"https://www.scopus.com/inward/record.uri?eid=2-s2.0-85105793763&doi=10.1016%2fj.ibusrev.2021.101863&partnerID=40&md5=3dce7c6d6e8b5c17f2f828533ffb5b16","By building on insights from institutional isomorphism, this paper investigates the development paths of latecomer business schools in Hong Kong, (South) Korea, Singapore, and Taiwan. The global isomorphic pressure prevalent in higher education (e.g. the global regime of rankings) drives latecomers to imitate the practices of incumbents in order to enhance their academic impact through business and management research. Our study argues that latecomers respond to global isomorphism by forging their own paths. Our analysis shows that business knowledge production in Hong Kong and Singapore was more responsive to coercive (research strategy) and normative (faculty recruitment strategy) isomorphic pressure than Korea and Taiwan. The response to mimetic isomorphic pressure (co-authorship strategy) was less salient in Hong Kong and Taiwan than in Singapore and Korea. Further, we find that research, faculty recruitment, and co-authorship strategies affect the academic impact (citations) of the higher education institutions across each country differently. Our study sheds new light on the role of global isomorphism in the emergence of latecomer business schools. © 2021 Elsevier Ltd","Business school; Catch up; Citations; Isomorphism; Latecomer",""
